{
  "$schema": "./schema.json",
  "area": "cyber",
  "title": "Pentest e Red Team em 12 meses",
  "source": {
    "title": "Roadmap de estudos em cibersegurança para migração de Fullstack a Pentest e Red Team em 6–12 meses (Pesquisa aprofundada do ChatGPT, roadmap sustentável de doze meses)",
    "url": "https://chatgpt.com/c/6ada0786-cf78-83e9-90a4-3fccb6f61474"
  },
  "sourcePace": "10 a 14 h por semana",
  "units": [
    {
      "id": "cyber-01",
      "phase": "Mês 1",
      "title": "TCP/IP, addressing e sub-redes",
      "deliverable": "Exercícios de rede resolvidos",
      "sessions": [
        {
          "kind": "study",
          "minutes": 60,
          "what": "Estudar: TCP/IP, addressing e sub-redes"
        },
        {
          "kind": "practice",
          "minutes": 60,
          "what": "Praticar no laboratório: TCP/IP, addressing e sub-redes"
        },
        {
          "kind": "deliverable",
          "minutes": 120,
          "what": "Exercícios de rede resolvidos"
        }
      ]
    },
    {
      "id": "cyber-02",
      "phase": "Mês 1",
      "title": "DNS, ARP, TCP/UDP/ICMP",
      "deliverable": "Capturas comentadas",
      "sessions": [
        {
          "kind": "study",
          "minutes": 60,
          "what": "Estudar: DNS, ARP, TCP/UDP/ICMP"
        },
        {
          "kind": "practice",
          "minutes": 60,
          "what": "Praticar no laboratório: DNS, ARP, TCP/UDP/ICMP"
        },
        {
          "kind": "deliverable",
          "minutes": 120,
          "what": "Capturas comentadas"
        }
      ]
    },
    {
      "id": "cyber-03",
      "phase": "Mês 1",
      "title": "HTTP/S, TLS e proxy",
      "deliverable": "Fluxo request/TLS documentado",
      "sessions": [
        {
          "kind": "study",
          "minutes": 60,
          "what": "Estudar: HTTP/S, TLS e proxy"
        },
        {
          "kind": "practice",
          "minutes": 60,
          "what": "Praticar no laboratório: HTTP/S, TLS e proxy"
        },
        {
          "kind": "deliverable",
          "minutes": 120,
          "what": "Fluxo request/TLS documentado"
        }
      ]
    },
    {
      "id": "cyber-04",
      "phase": "Mês 1",
      "title": "Wireshark/tcpdump e revisão",
      "deliverable": "Mini análise de PCAP",
      "sessions": [
        {
          "kind": "study",
          "minutes": 60,
          "what": "Estudar: Wireshark/tcpdump e revisão"
        },
        {
          "kind": "practice",
          "minutes": 60,
          "what": "Praticar no laboratório: Wireshark/tcpdump e revisão"
        },
        {
          "kind": "deliverable",
          "minutes": 120,
          "what": "Mini análise de PCAP"
        }
      ]
    },
    {
      "id": "cyber-05",
      "phase": "Mês 2",
      "title": "Linux administração",
      "deliverable": "VM configurada do zero",
      "sessions": [
        {
          "kind": "study",
          "minutes": 60,
          "what": "Estudar: Linux administração"
        },
        {
          "kind": "practice",
          "minutes": 60,
          "what": "Praticar no laboratório: Linux administração"
        },
        {
          "kind": "deliverable",
          "minutes": 120,
          "what": "VM configurada do zero"
        }
      ]
    },
    {
      "id": "cyber-06",
      "phase": "Mês 2",
      "title": "Linux permissions/processes/services",
      "deliverable": "Checklist de investigação",
      "sessions": [
        {
          "kind": "study",
          "minutes": 60,
          "what": "Estudar: Linux permissions/processes/services"
        },
        {
          "kind": "practice",
          "minutes": 60,
          "what": "Praticar no laboratório: Linux permissions/processes/services"
        },
        {
          "kind": "deliverable",
          "minutes": 120,
          "what": "Checklist de investigação"
        }
      ]
    },
    {
      "id": "cyber-07",
      "phase": "Mês 2",
      "title": "Windows + PowerShell",
      "deliverable": "Scripts administrativos simples",
      "sessions": [
        {
          "kind": "study",
          "minutes": 60,
          "what": "Estudar: Windows + PowerShell"
        },
        {
          "kind": "practice",
          "minutes": 60,
          "what": "Praticar no laboratório: Windows + PowerShell"
        },
        {
          "kind": "deliverable",
          "minutes": 120,
          "what": "Scripts administrativos simples"
        }
      ]
    },
    {
      "id": "cyber-08",
      "phase": "Mês 2",
      "title": "Python/Bash/PowerShell",
      "deliverable": "Toolkit pessoal de automação",
      "sessions": [
        {
          "kind": "study",
          "minutes": 60,
          "what": "Estudar: Python/Bash/PowerShell"
        },
        {
          "kind": "practice",
          "minutes": 60,
          "what": "Praticar no laboratório: Python/Bash/PowerShell"
        },
        {
          "kind": "deliverable",
          "minutes": 120,
          "what": "Toolkit pessoal de automação"
        }
      ]
    },
    {
      "id": "cyber-09",
      "phase": "Mês 3",
      "title": "OWASP Top 10/WSTG",
      "deliverable": "Mapa de classes de falhas",
      "sessions": [
        {
          "kind": "study",
          "minutes": 60,
          "what": "Estudar: OWASP Top 10/WSTG"
        },
        {
          "kind": "practice",
          "minutes": 60,
          "what": "Praticar no laboratório: OWASP Top 10/WSTG"
        },
        {
          "kind": "deliverable",
          "minutes": 120,
          "what": "Mapa de classes de falhas"
        }
      ]
    },
    {
      "id": "cyber-10",
      "phase": "Mês 3",
      "title": "Burp básico e recon web",
      "deliverable": "Labs iniciais",
      "sessions": [
        {
          "kind": "study",
          "minutes": 60,
          "what": "Estudar: Burp básico e recon web"
        },
        {
          "kind": "practice",
          "minutes": 60,
          "what": "Praticar no laboratório: Burp básico e recon web"
        },
        {
          "kind": "deliverable",
          "minutes": 120,
          "what": "Labs iniciais"
        }
      ]
    },
    {
      "id": "cyber-11",
      "phase": "Mês 3",
      "title": "Authn, sessão e access control",
      "deliverable": "10+ labs temáticos",
      "sessions": [
        {
          "kind": "study",
          "minutes": 60,
          "what": "Estudar: Authn, sessão e access control"
        },
        {
          "kind": "practice",
          "minutes": 60,
          "what": "Praticar no laboratório: Authn, sessão e access control"
        },
        {
          "kind": "deliverable",
          "minutes": 120,
          "what": "10+ labs temáticos"
        }
      ]
    },
    {
      "id": "cyber-12",
      "phase": "Mês 3",
      "title": "Injection e XSS",
      "deliverable": "Relatório de vulnerabilidade",
      "sessions": [
        {
          "kind": "study",
          "minutes": 60,
          "what": "Estudar: Injection e XSS"
        },
        {
          "kind": "practice",
          "minutes": 60,
          "what": "Praticar no laboratório: Injection e XSS"
        },
        {
          "kind": "deliverable",
          "minutes": 120,
          "what": "Relatório de vulnerabilidade"
        }
      ]
    },
    {
      "id": "cyber-13",
      "phase": "Mês 4",
      "title": "SSRF e server-side vulnerabilities",
      "deliverable": "Labs intermediários",
      "sessions": [
        {
          "kind": "study",
          "minutes": 60,
          "what": "Estudar: SSRF e server-side vulnerabilities"
        },
        {
          "kind": "practice",
          "minutes": 60,
          "what": "Praticar no laboratório: SSRF e server-side vulnerabilities"
        },
        {
          "kind": "deliverable",
          "minutes": 120,
          "what": "Labs intermediários"
        }
      ]
    },
    {
      "id": "cyber-14",
      "phase": "Mês 4",
      "title": "APIs REST e tokens",
      "deliverable": "API vulnerável avaliada",
      "sessions": [
        {
          "kind": "study",
          "minutes": 60,
          "what": "Estudar: APIs REST e tokens"
        },
        {
          "kind": "practice",
          "minutes": 60,
          "what": "Praticar no laboratório: APIs REST e tokens"
        },
        {
          "kind": "deliverable",
          "minutes": 120,
          "what": "API vulnerável avaliada"
        }
      ]
    },
    {
      "id": "cyber-15",
      "phase": "Mês 4",
      "title": "Business logic e advanced access control",
      "deliverable": "Labs sem hints",
      "sessions": [
        {
          "kind": "study",
          "minutes": 60,
          "what": "Estudar: Business logic e advanced access control"
        },
        {
          "kind": "practice",
          "minutes": 60,
          "what": "Praticar no laboratório: Business logic e advanced access control"
        },
        {
          "kind": "deliverable",
          "minutes": 120,
          "what": "Labs sem hints"
        }
      ]
    },
    {
      "id": "cyber-16",
      "phase": "Mês 4",
      "title": "Projeto web completo",
      "deliverable": "Relatório + correções",
      "sessions": [
        {
          "kind": "study",
          "minutes": 60,
          "what": "Estudar: Projeto web completo"
        },
        {
          "kind": "practice",
          "minutes": 60,
          "what": "Praticar no laboratório: Projeto web completo"
        },
        {
          "kind": "deliverable",
          "minutes": 120,
          "what": "Relatório + correções"
        }
      ]
    },
    {
      "id": "cyber-17",
      "phase": "Mês 5",
      "title": "Reconhecimento e scanning",
      "deliverable": "Checklist de enumeração",
      "sessions": [
        {
          "kind": "study",
          "minutes": 60,
          "what": "Estudar: Reconhecimento e scanning"
        },
        {
          "kind": "practice",